{
  "schemaVersion": "1.0",
  "patchId": "set-pin-default-example",
  "projectName": "我的项目",
  "description": "Validate changing a Blueprint pin default.",
  "assets": [
    {
      "assetPath": "/Game/UEAgentKitWriteTests/BP_PatchTarget.BP_PatchTarget",
      "expectedRevision": "sha256:aaaaaaaaaaaaaaaaaaaaaaaaaaaaaaaaaaaaaaaaaaaaaaaaaaaaaaaaaaaaaaaa",
      "expectedAssetClass": "/Script/Engine.Blueprint",
      "operations": [
        {
          "operationId": "set-pin-value",
          "operation": "setPinDefault",
          "target": {
            "graphGuid": "11111111-1111-1111-1111-111111111111",
            "nodeGuid": "22222222-2222-2222-2222-222222222222",
            "pinName": "NewValue"
          },
          "value": "42"
        }
      ]
    }
  ]
}
